"conversation_id_str","created_at","favorite_count","full_text","id_str","image_url","in_reply_to_screen_name","lang","location","quote_count","reply_count","retweet_count","tweet_url","user_id_str","username"
"1786032673963794614","Thu May 02 13:59:07 +0000 2024","1","Ada 3.156 siswa SD dan SMP di Pulau Tagulandang Kabupaten Sitaro yang terdampak erupsi Gunung Ruang. Mereka kini ikut dalam pengungsian. #publisherstory #manadobacirita https://t.co/3BN2mQKcPd","1786032673963794614","","","in","","0","0","0","https://twitter.com/kumparan/status/1786032673963794614","759692754985242625","kumparan"
"1786031865016787158","Thu May 02 13:55:54 +0000 2024","0","Btw orang-orang yang terdampar erupsi Gunung Ruang pada ngungsi ke Siau padahal di Siau juga ada Gunung Awu yang statusnya siaga...","1786031865016787158","","","in","","1","1","0","https://twitter.com/cecramide/status/1786031865016787158","1766290050499891200","cecramide"
"1786030663977865358","Thu May 02 13:51:07 +0000 2024","0","Erupsi Gunung Ruang: 6 Bandara Sudah Beroperasi Sam Ratulangi Masih Ditutup https://t.co/FXmA79o14a #Bisnis","1786030663977865358","","","in","Jakarta","0","0","0","https://twitter.com/liputan6dotcom/status/1786030663977865358","47596019","liputan6dotcom"
"1786030189539160174","Thu May 02 13:49:14 +0000 2024","0","Personil Polres Sitaro di pimpin Kapolres Akbp Iwan Permadi S.E. bantu evakuasi masyarakat Tagulandang pasca erupsi Gunung Ruang lewat jalur laut dipelabuhan Minanga Kec. Tagulandang Selatan menuju Bitung pada Rabu 1/5/2024. #humaspoldasulut https://t.co/v8v6o3s42f","1786030189539160174","https://pbs.twimg.com/media/GMlA-i4awAABQZp.jpg","","in","Jalan Bethesda No. 62 Manado","0","0","0","https://twitter.com/poldasulut_/status/1786030189539160174","1240859808070127622","poldasulut_"
"1786029894964826550","Thu May 02 13:48:04 +0000 2024","0","GunungRuang Volcanic Eruption #sulawesiutara #gunungruang https://t.co/RKKkNhwoaa","1786029894964826550","","","de","","0","0","0","https://twitter.com/bmn_73/status/1786029894964826550","1617385064740052992","bmn_73"
"1786028763815518632","Thu May 02 13:43:34 +0000 2024","2","Gunung Ruang Sulawesi Erupsi Maskapai AirAsia Batalkan 21 Penerbangan Rute Malaysia https://t.co/6VFGOHzT15","1786028763815518632","","","in","","0","0","1","https://twitter.com/VIVAcoid/status/1786028763815518632","41730943","VIVAcoid"
"1786028633095860700","Thu May 02 13:43:03 +0000 2024","0","https://t.co/irtbgufUKW UPDATE! Oprasional Bandara Sam Ratulangi Ditutup Hingga 24 Jam Kedepan #manado #HOAX #sulut #Sitaro #tagulandang #erupsi #larva #gunungruang #samratulangi #bandara","1786028633095860700","","","in","Indonesia","0","0","0","https://twitter.com/Jurnalpatroli_/status/1786028633095860700","1507307226058223618","Jurnalpatroli_"
"1786027911453331769","Thu May 02 13:40:11 +0000 2024","1","https://t.co/Gens5p1UNb Kabar Hoax Gunung Ruang Buat Panik Warga Tagulandang Sulut #manado #HOAX #sulut #Sitaro #tagulandang #erupsi #larva #gunungruang","1786027911453331769","","","in","Indonesia","0","0","0","https://twitter.com/Jurnalpatroli_/status/1786027911453331769","1507307226058223618","Jurnalpatroli_"
"1786027753252503755","Thu May 02 13:39:33 +0000 2024","2","Mitigasi Erupsi Gunung Ruang dan Peran Strategis TNI AL https://t.co/6tO2gAzeWD","1786027753252503755","","","in","Indonesia","0","0","2","https://twitter.com/kompasiana/status/1786027753252503755","23786106","kompasiana"
"1786027637674291525","Thu May 02 13:39:06 +0000 2024","2","Erupsi Gunung Ruang Bandara Sam Ratulangi Belum Aman untuk Penerbangan https://t.co/Uw0ynumzrr #TempoBisnis","1786027637674291525","","","in","Indonesia","0","0","0","https://twitter.com/tempodotco/status/1786027637674291525","18129942","tempodotco"
"1786027560058724661","Thu May 02 13:38:47 +0000 2024","1","Rabu 1 Mei 2024 pukul 22.30 wita bertolak dari pelabuhan Minanga kecamatan Tagulandang Selatan kabupaten Kepulauan Sitaro KMP Lokong Banua yang membawa pengungsi erupsi Gunung Ruang dengan tujuan Pelabuhan Bitung. https://t.co/bGsyxlgfdx","1786027560058724661","https://pbs.twimg.com/ext_tw_video_thumb/1786026740202266624/pu/img/eL1ytOSNMXCPlK7_.jpg","","in","Jalan Bethesda No. 62 Manado","0","0","1","https://twitter.com/poldasulut_/status/1786027560058724661","1240859808070127622","poldasulut_"
"1786025285701513482","Thu May 02 13:31:32 +0000 2024","0","Banjir dan Longsor di Sumatera Barat dan Erupsi Gunung Ruang di Kabupaten Sitaro (Sulawesi Utara) yang diselenggarakan di Kantor Kemenko PMK pada Kamis (2/5/2024).","1786025735699963969","","kemenkopmk","in","Jakarta","0","0","0","https://twitter.com/kemenkopmk/status/1786025735699963969","2461082029","kemenkopmk"
"1786025285701513482","Thu May 02 13:30:59 +0000 2024","0","bencana longsor di Kab. Tana Toraja banjir dan longsor di Kab. Padang Pariaman dan Pesisir Selatan serta erupsi Gunung Api Ruang di Sulawesi Utara yang telah dilaksanakan dengan baik oleh kementerian/lembaga dan pemerintah daerah.","1786025594721059056","","kemenkopmk","in","Jakarta","0","2","0","https://twitter.com/kemenkopmk/status/1786025594721059056","2461082029","kemenkopmk"
"1786025139559444917","Thu May 02 13:29:10 +0000 2024","0","Penutupan operasional Bandara Sam Ratulangi di Manado Sulawesi Utara diperpanjang karena erupsi gunung api Ruang yang masih terus terjadi. Penutupan diberlakukan hingga Kamis sore pukul 18.00 WITA. #gunungapiruang #gunungruang #erupsigunungruang #erupsigunung https://t.co/ubrJbHxcEl","1786025139559444917","https://pbs.twimg.com/ext_tw_video_thumb/1786025061176279040/pu/img/NV9hFSTPKcR8ji6J.jpg","","in","","0","1","0","https://twitter.com/Metro_TV/status/1786025139559444917","57261519","Metro_TV"
"1786023106022441291","Thu May 02 13:21:05 +0000 2024","6","Gambaran kerusakan dari para bangunan permukiman penduduk diterjang abu panas gunung ruang semoga diberikan kesabaran n isbiru...isbiru...isbiru https://t.co/KIjc0NA1hm","1786023106022441291","https://pbs.twimg.com/media/GMk6i8VbMAAAB5M.jpg","","in","Bumi Nabung, Indonesia","0","0","1","https://twitter.com/DambaanA/status/1786023106022441291","1603570929635692545","DambaanA"
"1786021596815392878","Thu May 02 13:15:06 +0000 2024","4","301 KK Bermukim di Kawasan Gunung Ruang Direlokasi Ke Manado-Minahasa https://t.co/TiuhT2wZ7M","1786021596815392878","","","in","","0","0","2","https://twitter.com/CNNIndonesia/status/1786021596815392878","17128975","CNNIndonesia"
"1786020742758625480","Thu May 02 13:11:42 +0000 2024","1","PLN hadir dengan langkah tanggap pascaerupsi Gunung Ruang memastikan kelistrikan Pulau Tagulandang kembali berfungsi optimal untuk kebutuhan masyarakat #PLNuntukIndonesia https://t.co/er3tyvkEJm","1786020742758625480","https://pbs.twimg.com/media/GMk4ZXub0AA6L3q.jpg","","in","","0","0","0","https://twitter.com/EldenNadin/status/1786020742758625480","1580154754130247680","EldenNadin"
"1786020529318855019","Thu May 02 13:10:51 +0000 2024","1","Komitmen PLN untuk melayani masyarakat di Pulau Tagulandang tak terbendung terbukti dengan pemulihan kelistrikan yang cepat pascaerupsi Gunung Ruang #PLNuntukIndonesia https://t.co/prgl7X1PkD","1786020529318855019","https://pbs.twimg.com/media/GMk4M7CasAE-KkY.jpg","","in","","0","0","0","https://twitter.com/AmaraZoe5/status/1786020529318855019","1580155848252268544","AmaraZoe5"
"1786020396875255857","Thu May 02 13:10:19 +0000 2024","1","Peran strategis PLN dalam memulihkan kelistrikan Pulau Tagulandang pascaerupsi Gunung Ruang: kini listrik telah kembali normal untuk masyarakat #PLNuntukIndonesia https://t.co/CnVgLy0sLv","1786020396875255857","https://pbs.twimg.com/media/GMk4FN3bAAAavfM.jpg","","in","DKI Jakarta, Indonesia","0","0","0","https://twitter.com/ArunaKhanza/status/1786020396875255857","1580792634305523713","ArunaKhanza"
"1786020238917771346","Thu May 02 13:09:42 +0000 2024","2","PLN mengambil langkah cepat dalam mengatasi dampak erupsi Gunung Ruang sehingga kelistrikan Pulau Tagulandang dapat kembali berjalan dengan normal #PLNuntukIndonesia https://t.co/HqeEbUeC6F","1786020238917771346","https://pbs.twimg.com/media/GMk37-xawAAZrHk.jpg","","in","","0","0","0","https://twitter.com/Sunshinee2001/status/1786020238917771346","1580795269708271616","Sunshinee2001"
"1786020109318041723","Thu May 02 13:09:11 +0000 2024","1","Dukungan PLN terhadap Pulau Tagulandang pascaerupsi Gunung Ruang menunjukkan komitmen PLN dalam menjaga ketersediaan listrik bagi masyarakat #PLNuntukIndonesia https://t.co/f8Nm7hvcSq","1786020109318041723","https://pbs.twimg.com/media/GMk30gfbQAAttN1.jpg","","in","","0","0","0","https://twitter.com/CherinBloom/status/1786020109318041723","1640761460694614017","CherinBloom"
"1786019983346270269","Thu May 02 13:08:41 +0000 2024","2","Gunung Ruang Menyemburkan Abu Vulkanik Penutupan Bandara Sam Ratulangi Diperpanjang https://t.co/upGXE5PYaL","1786019983346270269","","","in","","0","0","0","https://twitter.com/RepelitaO/status/1786019983346270269","1225432911899324419","RepelitaO"
"1786019935615062516","Thu May 02 13:08:29 +0000 2024","1","PLN membuktikan kesiapannya dalam menghadapi bencana alam dengan mengembalikan kelistrikan Pulau Tagulandang ke kondisi normal pascaerupsi Gunung Ruang #PLNuntukIndonesia https://t.co/v3lUKAygrd","1786019935615062516","https://pbs.twimg.com/media/GMk3qY2bQAAlhYw.jpg","","in","Jakarta Timur, DKI Jakarta","0","0","0","https://twitter.com/Rizkypyk/status/1786019935615062516","1640769498457464832","Rizkypyk"
"1786019801565180128","Thu May 02 13:07:57 +0000 2024","1","Respon cepat PLN pascaerupsi Gunung Ruang: Pulau Tagulandang kembali mendapatkan kelistrikan yang stabil dan andal #PLNuntukIndonesia https://t.co/0z9FfND9Jy","1786019801565180128","https://pbs.twimg.com/media/GMk3imCaMAE7tml.jpg","","in","Purwokerto Utara, Indonesia","0","0","0","https://twitter.com/Vitavityy/status/1786019801565180128","1641434854549241856","Vitavityy"
"1786019672300900813","Thu May 02 13:07:27 +0000 2024","1","PLN bergerak tanggap setelah erupsi Gunung Ruang memastikan masyarakat Pulau Tagulandang tetap terlayani dengan kelistrikan yang normal #PLNuntukIndonesia https://t.co/9hk12ZQOBo","1786019672300900813","https://pbs.twimg.com/media/GMk3bC7bUAA-_UH.jpg","","in","Jakarta Pusat, DKI Jakarta","0","0","0","https://twitter.com/Mikhathy/status/1786019672300900813","1641451237597122562","Mikhathy"
"1786019510534938977","Thu May 02 13:06:48 +0000 2024","1","Kiprah PLN dalam menghadapi erupsi Gunung Ruang: kelistrikan Pulau Tagulandang kembali stabil berkat langkah-langkah cepat PLN #PLNuntukIndonesia https://t.co/CSJR25SLpm","1786019510534938977","https://pbs.twimg.com/media/GMk3RpebsAAEoCm.jpg","","in","","0","0","0","https://twitter.com/Yayiggg/status/1786019510534938977","1641449051513327618","Yayiggg"
"1786018850271899705","Thu May 02 13:04:11 +0000 2024","0","BNPB Minta Gubernur Sulawesi Utara Tetapkan Status Gawat Darurat Dampak Erupsi Gunung Ruang https://t.co/zFzzdxx9dX #TempoVideo","1786018850271899705","","","in","Indonesia","0","1","0","https://twitter.com/tempodotco/status/1786018850271899705","18129942","tempodotco"
"1786016023705162033","Thu May 02 12:52:57 +0000 2024","0","Gunung Ruang Sulawesi Utara Indonesia","1786016023705162033","","","in","emperan kav 52 & 53","0","0","0","https://twitter.com/swinger_saham/status/1786016023705162033","1780191362979434497","swinger_saham"
"1786012673836224673","Thu May 02 12:39:38 +0000 2024","0","Ahli vulkanologi Indonesia Dr Surono mengatakan kepada CNA kecil sekali kemungkinannya terjadi tsunami. Dia mendasarkan pernyataannya ini dari sifat erupsi Gunung Ruang dalam beberapa hari terakhir. https://t.co/mvHHjSdgZ7","1786012673836224673","","","in","Singapore","0","0","0","https://twitter.com/EricssenWen/status/1786012673836224673","45295624","EricssenWen"
"1786012542164414787","Thu May 02 12:39:07 +0000 2024","0","Tidak pernah terbayangkan bila Gunung Ruang meletus hebat sampai bisa tsunami Gempa bawen atau pacitan tak henti henti dengan 6 magnitude sedangkan terjadi juga gempa di Bandung dengan kekuatan 6 magnitude juga tanpa henti. Sumpah ini saya sampai bengong","1786012542164414787","","","in","","0","0","0","https://twitter.com/aseprivva/status/1786012542164414787","1636667961883889666","aseprivva"
"1786011859407241424","Thu May 02 12:36:24 +0000 2024","0","Apa Itu Gas SO2 Gunung Ruang? https://t.co/fWHrk7hanz","1786011859407241424","","","in","","0","0","1","https://twitter.com/CNNIndonesia/status/1786011859407241424","17128975","CNNIndonesia"
"1785990720538755355","Thu May 02 12:35:25 +0000 2024","0","@nafasidn Min mau tanya . Erupsi gunung ruang apakah berdampak dengan udara di pulau jawa ?","1786011611624575443","","nafasidn","in","Bandung ","0","0","0","https://twitter.com/albertyudhistia/status/1786011611624575443","251569339","albertyudhistia"
"1786010250145099849","Thu May 02 12:30:00 +0000 2024","1","Update Dampak Erupsi Gunung Ruang Ratusan Pengungsi Naiki Kapal Bea Cukai di Tagulandang https://t.co/k8NuO4BRTE","1786010250145099849","","","in","iNews Tower","0","0","0","https://twitter.com/officialinews_/status/1786010250145099849","132078023","officialinews_"
"1786007491190591534","Thu May 02 12:19:02 +0000 2024","0","Menko PMK Ungkap Gunung Ruang Masih Berpotensi Erupsi Susulan Lebih Besar https://t.co/bHZedn3Zpy","1786007491190591534","","","in","Jakarta Capital Region","0","0","0","https://twitter.com/idx_channel/status/1786007491190591534","4755284968","idx_channel"
"1786006716108480647","Thu May 02 12:15:58 +0000 2024","0","Pray for Gunung Ruang Bandara masih tutup sampe besok sore. Ketambahan 1 hari lagi ketemu pacar gw yg bego LDR itu ","1786006716108480647","","","in","Kota Manado, Sulawesi Utara","0","1","0","https://twitter.com/pherendesuyo/status/1786006716108480647","404115156","pherendesuyo"
"1786006510830805150","Thu May 02 12:15:09 +0000 2024","0","Ribuan Rumah Rusak Terdampak Erupsi Gunung Ruang di Sitaro Sulut https://t.co/qiqv4f5VJa https://t.co/1CFJCpP8gX","1786006510830805150","https://pbs.twimg.com/media/GMkrdSjagAALepO.jpg","","in","Solo, Central Java, Indonesia","0","0","0","https://twitter.com/soloposdotcom/status/1786006510830805150","155169715","soloposdotcom"
"1786006398528352487","Thu May 02 12:14:42 +0000 2024","1","PLN tindak cepat! Pulau Tagulandang kembali normal setelah erupsi Gunung Ruang. #PLNuntukIndonesia https://t.co/yphW2S4FXO","1786006398528352487","https://pbs.twimg.com/media/GMkrWTya8AA7fGi.jpg","","in","","0","0","0","https://twitter.com/ZxMelly/status/1786006398528352487","1633055142634475520","ZxMelly"
"1786006301442806212","Thu May 02 12:14:19 +0000 2024","1","PLN senantiasa bersama masyarakat. kembali hadirkan terang dan harapan di pulau Tagulandang pascaerupsi Gunung Ruang. #PLNuntukIndonesia https://t.co/dfTg2GIlVM","1786006301442806212","https://pbs.twimg.com/media/GMkrQpRacAEHKkf.jpg","","in","","0","0","0","https://twitter.com/Deelleaa/status/1786006301442806212","1633728235417776128","Deelleaa"
"1786006209470013574","Thu May 02 12:13:57 +0000 2024","1","Gerak cepat PLN menjadikan Pulau Tagulandang kembali bercahaya setelah erupsi Gunung Ruang. #PLNuntukIndonesia https://t.co/tHxcIHiDgC","1786006209470013574","https://pbs.twimg.com/media/GMkrLP2bcAAn1uG.jpg","","in","","0","0","0","https://twitter.com/Zeriskayy/status/1786006209470013574","1633726932088160256","Zeriskayy"
"1786006012853682351","Thu May 02 12:13:10 +0000 2024","1","PLN tak kenal lelah kelistrikan Pulau Tagulandang pulih setelah erupsi Gunung Ruang. #PLNuntukIndonesia https://t.co/un9MXMDR8U","1786006012853682351","https://pbs.twimg.com/media/GMkq_0LbEAAHDMe.jpg","","in","","0","0","0","https://twitter.com/Sazkiaa_2/status/1786006012853682351","1633372280595296261","Sazkiaa_2"
"1786005921136787691","Thu May 02 12:12:48 +0000 2024","1","PLN Gercep! menjadikan kelistrikan Pulau Tagulandang kembali normal setelah erupsi Gunung Ruang. #PLNuntukIndonesia https://t.co/qRQvLybckf","1786005921136787691","https://pbs.twimg.com/media/GMkq6dLaUAAf5cq.jpg","","in","","0","0","0","https://twitter.com/_GilangRam/status/1786005921136787691","1633044326879211520","_GilangRam"
"1786005753423425742","Thu May 02 12:12:08 +0000 2024","1","Dengan kerja keras dan kegigihan PLN memastikan kelistrikan pulau Tagulandang kembali normal setelah erupsi Gunung Ruang. #PLNuntukIndonesia https://t.co/9XI4pB6sj9","1786005753423425742","https://pbs.twimg.com/media/GMkqwzdbkAAPfhb.jpg","","in","","0","0","0","https://twitter.com/_Mariaaaww/status/1786005753423425742","1632846988495695873","_Mariaaaww"
"1786005538754716109","Thu May 02 12:11:17 +0000 2024","1","Langkah cepat PLN memastikan kelistrikan pulau Tagulandang kembali normal pascaerupsi Gunung Ruang. #PLNuntukIndonesia https://t.co/N8Epy9jyTv","1786005538754716109","https://pbs.twimg.com/media/GMkqkJwbwAAi7BH.jpg","","in","","0","0","0","https://twitter.com/Saraaaarah_/status/1786005538754716109","1717254956301144065","Saraaaarah_"
"1786004034354385204","Thu May 02 12:05:18 +0000 2024","1","Gunung Ruang Masih Erupsi #BNetwork https://t.co/sNSsBUh6SS","1786004034354385204","","","in","Jakarta","0","0","1","https://twitter.com/Beritasatu/status/1786004034354385204","154102750","Beritasatu"
"1786003973696278635","Thu May 02 12:05:04 +0000 2024","0","12 Ribu Orang Dievakuasi Pasca Erupsi Gunung Ruang BNPB: Radius 7 Km Tak Ditempati https://t.co/yxFzqKbjan","1786003973696278635","","","in","Jakarta Capital Region","0","0","0","https://twitter.com/idx_channel/status/1786003973696278635","4755284968","idx_channel"
"1786002356389519362","Thu May 02 12:01:24 +0000 2024","0","Tadi sempat lihat ada warga yang masih bertahan dan sempat live kondisi Gunung Ruang. Dari Tagulandang masih terdengar suara dari dalam perut gunung. Kayak suara air mendidih. Konon statusnya sudah naik ke level 5.","1786003050207015292","","redlicclenatan","in","Indonesia","0","2","0","https://twitter.com/redlicclenatan/status/1786003050207015292","1770344295054376960","redlicclenatan"
"1785999602648522848","Thu May 02 11:47:42 +0000 2024","0","Abu dri gunung ruang banyak banget tanaman disekitar rumah I ketutupan abu","1785999602648522848","","","in","she/her, rant meow","0","0","0","https://twitter.com/niakicik/status/1785999602648522848","1462777152294637571","niakicik"
"1785997645737267489","Thu May 02 11:39:55 +0000 2024","2","Dua Desa di Tagulandang Akan Direlokasi Imbas Erupsi Gunung Ruang https://t.co/HK3Nq3FdnQ","1785997645737267489","","","in","","0","1","0","https://twitter.com/CNNIndonesia/status/1785997645737267489","17128975","CNNIndonesia"
"1785997062494134603","Thu May 02 11:37:36 +0000 2024","0","Waspada Segala Potensi Letusan Gunung Ruang https://t.co/wx4C6HVEoX","1785997062494134603","","","in","Indonesia","0","0","0","https://twitter.com/kompasiana/status/1785997062494134603","23786106","kompasiana"
"1785996948287451336","Thu May 02 11:37:09 +0000 2024","1","FOTO: Rumah-rumah Rusak Terkena Dampak Erupsi Gunung Ruang https://t.co/7IAPVcxL03","1785996948287451336","","","in","","0","0","0","https://twitter.com/CNNIndonesia/status/1785996948287451336","17128975","CNNIndonesia"
"1785875643340931333","Thu May 02 11:36:49 +0000 2024","11","@yahee_r ngga aktifitasnya pindah di gunung ruang","1785996863403143528","","yahee_r","in","Indonesia","0","0","1","https://twitter.com/zakiberkata/status/1785996863403143528","3165540462","zakiberkata"
"1785979845555724393","Thu May 02 10:29:11 +0000 2024","0","Adakah orang yang mau berbagi kondisi langit di sekitaran gunung ruang saat matahari terbenam Setelah letusan gunung biasanya langit mengeluarkan warna aneh Mulai dari oranye merah sampai ungu kehitaman ","1785979845555724393","","","in","","0","0","0","https://twitter.com/orange_puppy331/status/1785979845555724393","1328167447786971136","orange_puppy331"
"1785979821279093147","Thu May 02 10:29:05 +0000 2024","0","Dampak Erupsi Gunung Ruang Penutupan Bandara Sam Ratulangi Diperpanjang https://t.co/QwavFzFQDk","1785979821279093147","","","in","","0","0","1","https://twitter.com/dailynesiaco/status/1785979821279093147","1715358708363104257","dailynesiaco"
"1785972583156027690","Thu May 02 10:12:46 +0000 2024","1","6. Kedahsyatan letusan gunung berapi dinyatakan dg energi termalnya yg sebanding dg volume magma segar (DRE) letusan. Saat kolom letusan Ruang runtuh &amp; kembali ke parasbumi terbentuk awan panas letusan yg lantas dominan mengalir ke timur &amp; timur laut hingga mencapai laut.","1785975712568242550","","marufins","in","KBM | DPK","0","1","0","https://twitter.com/marufins/status/1785975712568242550","740782668","marufins"
"1785975703739285840","Thu May 02 10:12:44 +0000 2024","0","Bersih dari Abu Vulkanik Gunung Ruang Bandara Djalaluddin Gorontalo Dibuka Lagi Via : https://t.co/x13Ga3BvPf #NOTD","1785975703739285840","","","in","Yogyakarta, Indonesia","0","0","0","https://twitter.com/masdhafm/status/1785975703739285840","59979374","masdhafm"
"1785975382220644774","Thu May 02 10:11:27 +0000 2024","0"," The first person you think of in the morning is either the cause of your happiness or the cause of your pain. #breaking #news #history #music #art Tag chika gunung ruang #viralvideo KIPK #earthquake irak civil war 2 mei Apple Boeing Palestine Gaza zionist","1785975382220644774","","","en","Indonesia","0","0","0","https://twitter.com/mynameisastro_/status/1785975382220644774","205068116","mynameisastro_"
"1785974307379958183","Thu May 02 10:07:11 +0000 2024","0"," Gajah terbang keliatan ? + keliatan bohongnya #breaking #news #history #music #art Tag chika gunung ruang #viralvideo KIPK #earthquake irak civil war 2 mei Apple Boeing Palestine Gaza zionist","1785974307379958183","","","in","Indonesia","0","0","0","https://twitter.com/mynameisastro_/status/1785974307379958183","205068116","mynameisastro_"
"1785973394422559125","Thu May 02 10:03:33 +0000 2024","0","&lt;p&gt;Berdasarkan data BNPB ada sekitar 9.083 warga yang harus dievakuasi keluar dari Pulau Tagulandang usai terjadinya erupsi Gunung Ruang Sulawesi Utara&lt;/p&gt; https://t.co/ErjNvnHrO8","1785973394422559125","","","in","Jakarta Capital Region, Indone","0","0","0","https://twitter.com/validnewsid/status/1785973394422559125","874558344593195008","validnewsid"
"1785972887758995942","Thu May 02 10:01:32 +0000 2024","0","&lt;p&gt;Berdasarkan data BNPB ada sekitar 9.083 warga yang harus dievakuasi keluar dari Pulau Tagulandang usai terjadinya erupsi Gunung Ruang&lt;/p&gt; https://t.co/iXHsvrAYz7","1785972887758995942","","","in","Jakarta Capital Region, Indone","0","0","0","https://twitter.com/validnewsid/status/1785972887758995942","874558344593195008","validnewsid"
"1785972886551081414","Thu May 02 10:01:32 +0000 2024","0","&lt;p&gt;Berdasarkan data BNPB ada sekitar 9.083 warga yang harus dievakuasi keluar dari Pulau Tagulandang usai terjadinya erupsi Gunung Ruang&lt;/p&gt; https://t.co/ErjNvnHrO8","1785972886551081414","","","in","Jakarta Capital Region, Indone","0","0","0","https://twitter.com/validnewsid/status/1785972886551081414","874558344593195008","validnewsid"
"1785972647098220818","Thu May 02 10:00:35 +0000 2024","0","Ancaman dari Erupsi Gunung Ruang 2 Desa Akan Dikosongkan Permanen https://t.co/ZNOw02d9S7 #TempoVideo","1785972647098220818","","","in","Indonesia","0","0","0","https://twitter.com/tempodotco/status/1785972647098220818","18129942","tempodotco"
"1785972583156027690","Thu May 02 10:00:20 +0000 2024","129","~ Letusan dahsyat kedua Gunung Ruang 2 kali lebih dahsyat dibanding letusan pertama ~ - utas - Sejak Selasa dinihari 30 April 2024 TU pukul 01.30 WIB hingga ~6 jam kemudian Gunung Ruang (Sulawesi Utara) meletus dahsyat lagi. Hanya 12 hari pasca letusan dahsyat yg pertama","1785972583156027690","","","in","KBM | DPK","1","1","32","https://twitter.com/marufins/status/1785972583156027690","740782668","marufins"
"1785970570582208818","Thu May 02 09:52:20 +0000 2024","0","Warga Tagulandang dibuat Panik oleh Hoax Gunung Ruang - https://t.co/abCF0cIqEE https://t.co/iMJTaU3t8t","1785970570582208818","https://pbs.twimg.com/media/GMkKxEObEAE9A5F.jpg","","in","Manado","0","0","0","https://twitter.com/beritamanado/status/1785970570582208818","130420120","beritamanado"
"1785968919980998676","Thu May 02 09:45:46 +0000 2024","1","Letusan semula Gunung Ruang tak jejas kualiti udara negara #BHnasional Ketua Pengarah Alam Sekitar (JAS) Datuk Wan Abdul Latiff Wan Jaffar berkata letusan semula Gunung Berapi Ruang di Sulawesi Utara Indonesia kemarin tak jejas kualiti udara negara. https://t.co/BxaioyHdw6","1785968919980998676","","","in","Malaysia","0","0","1","https://twitter.com/bharianmy/status/1785968919980998676","63070483","bharianmy"
"1785968769824940114","Thu May 02 09:45:11 +0000 2024","0","Bahas Gunung Ruang Pangdam XIII/Merdeka Rapat dengan Ka BNPB dan Stake Holder --------------------------------------------------- #puspentni #tni_angkatan_darat #kodamxiii #tniprima #profesional #responsif #integratif #modern #adaptif https://t.co/ezgtNNtoUM","1785968769824940114","","","in","Kota Manado, Sulawesi Utara","0","0","0","https://twitter.com/MdkXiii69096/status/1785968769824940114","1741440457052499968","MdkXiii69096"
"1785967528503898444","Thu May 02 09:40:15 +0000 2024","0","Gunung Ruang Erupsi Penerbangan Malaysia Terganggu https://t.co/J8C7yRjul6","1785967528503898444","","","in","Indonesia","0","0","0","https://twitter.com/detikTravel/status/1785967528503898444","240113510","detikTravel"
