"conversation_id_str","created_at","favorite_count","full_text","id_str","image_url","in_reply_to_screen_name","lang","location","quote_count","reply_count","retweet_count","tweet_url","user_id_str","username"
"1786947102083633507","Sun May 05 02:32:43 +0000 2024","0","Pada Minggu (05/05/2024) dini hari Menteri ATR/BPN bertolak ke Bandara Gorontalo Sulawesi Utara (Sulut) untuk kemudian melanjutkan perjalanan meninjau calon lahan relokasi warga pengungsi yang terdampak erupsi Gunung Ruang di Desa Modisi Kabupaten Bolaang Mongondow Selatan. https://t.co/BRN4dS4YAN","1786947102083633507","https://pbs.twimg.com/media/GMyCvBraMAAl2yX.jpg","","in","Jln. Basuki Rachmat,Kefamenanu","0","1","0","https://twitter.com/KantahKabTTU/status/1786947102083633507","4777911794","KantahKabTTU"
"1786946793424748576","Sun May 05 02:31:30 +0000 2024","1","Situasi gunung ruang tagulandang Sulawesi Utara 5 Mei 2024 https://t.co/ehqnCdWbr7","1786946793424748576","https://pbs.twimg.com/ext_tw_video_thumb/1786946735287463936/pu/img/uHWYG1NJFhFsB85U.jpg","","in","","0","0","0","https://twitter.com/IcalNurba51757/status/1786946793424748576","1754904275707424768","IcalNurba51757"
"1786914726930415805","Sun May 05 00:24:04 +0000 2024","0","Yea sorry @janinekrippner knows I subscribed to Gunung Ruang LavaFans account. I just don't have enough to support a faultine in my budget right now.","1786914726930415805","","","en","Cascadia","0","0","0","https://twitter.com/witch_volcano/status/1786914726930415805","125821148","witch_volcano"
"1786901807215906836","Sat May 04 23:32:44 +0000 2024","0","Kapolsek Likupang AKP Manase Sasikome bersinergi dengan TNI dan bantuan instansi terkait melakukan penjemputan para pengungsi bencana alam erupsi gunung ruang di pelabuhan Munte kemudian diarahkan Posko BPBD Pelabuhan Munte. #PolriPresisi #KasihPresisi #Polisiindonesia https://t.co/dIO7y0VUBg","1786901807215906836","https://pbs.twimg.com/media/GMxZuUiaoAApiHc.jpg","","in","Airmadidi","0","0","0","https://twitter.com/Pid_humasminut/status/1786901807215906836","2423232440","Pid_humasminut"
"1786899070495383945","Sat May 04 23:21:52 +0000 2024","0","KRI Kakap 811 Laksanakan Penyaluran Bantuan Sosial Berupa Bahan Makanan dan Evakuasi 488 Korban Erupsi Gunung Ruang Sulawesi Utara https://t.co/l6LmVd2SGa","1786899070495383945","","","in","Jakarta Capital Region","0","0","0","https://twitter.com/zonajakarta1/status/1786899070495383945","1219947729155047424","zonajakarta1"
"1786895651969843229","Sat May 04 23:08:17 +0000 2024","0","sejak gunung ruang meletus sunset di tempat aku jadi makin cantik sumpah. (emang udah cantik sih tapi makin cantik) https://t.co/rgLAyKO8QE","1786895651969843229","https://pbs.twimg.com/media/GMxUH_kbkAAHQty.jpg","","in","INTJ","0","0","0","https://twitter.com/keepsleepeeps/status/1786895651969843229","1719262790077349888","keepsleepeeps"
"1786892043408859196","Sat May 04 22:53:56 +0000 2024","0","Pemerintah Siapkan 301 Rumah Instan Untuk Korban Erupsi Gunung Ruang. Indonesia vs China Ginting Pegang Ribka Alfamart Malam Minggu https://t.co/oy6Gp3EG1K","1786892043408859196","https://pbs.twimg.com/media/GMxQ0YbaoAAWXly.jpg","","in","","0","0","1","https://twitter.com/Hildaabalqis/status/1786892043408859196","1773969656891781120","Hildaabalqis"
"1786891197249921072","Sat May 04 22:50:34 +0000 2024","1","Presiden Jokowi Instruksikan Jajaran Terkait Penanganan Pengungsi Akibat Erupsi Gunung Ruang. Indonesia vs China Alfamart Guinea Pegang Elkan Malam Minggu https://t.co/t1lcypPLU7","1786891197249921072","https://pbs.twimg.com/media/GMxQDR5bUAAsJuE.jpg","","in","","0","0","1","https://twitter.com/Zefanadinda/status/1786891197249921072","1772800082372653056","Zefanadinda"
"1786870303895019605","Sat May 04 21:27:33 +0000 2024","4","Pasca-Erupsi Wapres Minta Warga di Sekitar Gunung Ruang Ikuti Arahan Pemerintah https://t.co/Y6cELX1oEQ #News","1786870303895019605","","","in","Jakarta","0","1","0","https://twitter.com/liputan6dotcom/status/1786870303895019605","47596019","liputan6dotcom"
"1786851580609995052","Sat May 04 20:13:09 +0000 2024","0","Wapres Minta Warga Terdampak Erupsi Gunung Ruang Relokasi sesuai Petunjuk Pemerintah https://t.co/DuUN4TCP45","1786851580609995052","","","in","Jakarta Capital Region","0","0","0","https://twitter.com/idx_channel/status/1786851580609995052","4755284968","idx_channel"
"1786849922723275103","Sat May 04 20:06:34 +0000 2024","0","Helikopter Mulai Diterbangkan Angkut Korban Erupsi Gunung Ruang yang Sakit Data terakhir dari BNPB setidaknya dari... #NewsUpdate #BNPB #GunungRuang #ErupsiGunungRuang #Helikopter #KorbanErupsiRuang #Evakuasi https://t.co/jbYcMzSYyC https://t.co/szDARTUSut","1786849922723275103","https://pbs.twimg.com/media/GMwqXgMbAAALBbI.png","","in","","0","0","0","https://twitter.com/arahkitamedia_/status/1786849922723275103","1741804247933665280","arahkitamedia_"
"1786837737167081844","Sat May 04 19:18:09 +0000 2024","0","BNPB Bantah Pulau Tagulandang Bakal Tenggelam jika Erupsi Gunung Ruang Lebih Besar https://t.co/bOBq7bHxv5","1786837737167081844","","","in","Jakarta Capital Region","0","0","0","https://twitter.com/idx_channel/status/1786837737167081844","4755284968","idx_channel"
"1786833939405177100","Sat May 04 19:03:03 +0000 2024","0","Pagi Ini Asap Kawah Utama Gunung Ruang Berwarna Kelabu via @darilautID https://t.co/77LvW1bZRG","1786833939405177100","","","in","Gorontalo","0","0","0","https://twitter.com/verrianto_m/status/1786833939405177100","285553204","verrianto_m"
"1786833902038081669","Sat May 04 19:02:54 +0000 2024","0","Abu Vulkanik Gunung Ruang Dapat Merusak Badan Pesawat via @darilautID https://t.co/X2M6cDjQSa","1786833902038081669","","","in","Gorontalo","0","0","0","https://twitter.com/verrianto_m/status/1786833902038081669","285553204","verrianto_m"
"1786833857721098433","Sat May 04 19:02:44 +0000 2024","0","8 Bandara di Sulawesi Utara dan Gorontalo Ditutup Karena Letusan Gunung Ruang via @darilautID https://t.co/PwygBrkyDN","1786833857721098433","","","in","Gorontalo","0","0","0","https://twitter.com/verrianto_m/status/1786833857721098433","285553204","verrianto_m"
"1786827093340500231","Sat May 04 18:35:51 +0000 2024","0","Menteri AHY siap menjalankan instruksi Jokowi Selesaikan lahan di Sekitar gunung Ruang. https://t.co/zsn7a1ODyh","1786827093340500231","https://pbs.twimg.com/media/GMwVxbubYAAPEP4.jpg","","in","","0","0","0","https://twitter.com/AHYFans__/status/1786827093340500231","1607234087693213696","AHYFans__"
"1786822646057038326","Sat May 04 18:18:11 +0000 2024","3","Erupsi Gunung Ruang Masih Ada Sekitar 3.000Â Warga Belum Dievakuasi dariÂ Pulau Tagulandang https://t.co/DFlWEruuP8 #News","1786822646057038326","","","in","Jakarta","0","1","0","https://twitter.com/liputan6dotcom/status/1786822646057038326","47596019","liputan6dotcom"
"1786805878240460992","Sat May 04 17:11:33 +0000 2024","0","BNPB Janji Bakal Rehabilitasi dan Rekonstruksi Rumah Warga Terdampak Erupsi Gunung Ruang https://t.co/rAhPAL5L7X","1786805878240460992","","","in","Jakarta Capital Region","0","0","0","https://twitter.com/idx_channel/status/1786805878240460992","4755284968","idx_channel"
"1786802118650994915","Sat May 04 16:56:36 +0000 2024","0","Presiden Jokowi Instruksikan Jajaran Terkait Penanganan Pengungsi Akibat Erupsi Gunung Ruang https://t.co/tZ2iDNr6pO","1786802118650994915","","","in","","0","0","0","https://twitter.com/FBN_Net/status/1786802118650994915","1112363743243952130","FBN_Net"
"1786797292202467507","Sat May 04 16:37:26 +0000 2024","0","KLARIFIKASI HOAX MISLEADING CONTENT SULFUR DIOKSIDA DARI VULKANIK ERUPSI GUNUNG RUANG MENYEBAR KE PULAU JAWA https://t.co/E7kWQqu97N","1786797292202467507","https://pbs.twimg.com/media/GMv6qNLb0AA_uzQ.jpg","","in","","0","0","0","https://twitter.com/PanjaluPolsek/status/1786797292202467507","1392404276949913604","PanjaluPolsek"
"1786348052078629253","Sat May 04 16:19:52 +0000 2024","2","@beacukaiRI Mudah-mudahan warga yang terdampak erupsi gunung ruang selamat dan tidak diminta cukai setelah menerima bantuan dari instansi yang satu ini.","1786792873691865103","","beacukaiRI","in","Indonesia","0","0","0","https://twitter.com/hai_boodong/status/1786792873691865103","111217548","hai_boodong"
"1786790913441996858","Sat May 04 16:12:05 +0000 2024","1","6.125 Warga Terdampak Erupsi Gunung Ruang https://t.co/Y7r0Y6JZrB #TempoFoto","1786790913441996858","","","in","Indonesia","0","0","2","https://twitter.com/tempodotco/status/1786790913441996858","18129942","tempodotco"
"1786790666309443700","Sat May 04 16:11:06 +0000 2024","3","Aktivitas Gunung Ruang Menurun: Aktivitas Gunung Ruang di Kecamatan Tunggal Landang Kepulauan Sitaro Sulawesi Utara hingga Jumat (4/5/2024) pagi terus menurun. https://t.co/PeSMDSdnof","1786790666309443700","","","in","Pulo Gadung, Indonesia","0","1","1","https://twitter.com/tvOneNews/status/1786790666309443700","55507370","tvOneNews"
"1786789776034853121","Sat May 04 16:07:34 +0000 2024","1","Kepala BNPB Letjen TNI Suharyanto menemui pengungsi akibat erupsi Gunung Ruang yang ada di Pulau Siau dan Pulau Tagulandang Kabupaten Sitaro. #publisherstory #manadobacirita https://t.co/Y7uZ6gEDIi","1786789776034853121","","","in","","0","1","0","https://twitter.com/kumparan/status/1786789776034853121","759692754985242625","kumparan"
"1786789620677812565","Sat May 04 16:06:57 +0000 2024","0","Pemerintah Segera Relokasi 10 Ribu Warga Sekitar Erupsi Gunung Ruang https://t.co/CdAifXTNU5","1786789620677812565","","","in","Indonesia","0","0","0","https://twitter.com/tinjauid/status/1786789620677812565","1561384199726452736","tinjauid"
"1786785315136606459","Sat May 04 15:49:50 +0000 2024","1","4 Mei 2024 Bersama Sosma &amp; LH EM UB 2024 melakukan aksi kemanusiaan untuk mengumpulkan dana atas musibah meletusnya gunung Ruang di Sulawesi Utara #gunungruang #GalangDana https://t.co/FN1pNNBoVh","1786785315136606459","https://pbs.twimg.com/media/GMvvwTJbQAAbW7p.jpg","","in","Surakarta, Jawa Tengah","0","0","0","https://twitter.com/kalkyauthar/status/1786785315136606459","1351824454117072897","kalkyauthar"
"1786783959684415699","Sat May 04 15:44:27 +0000 2024","1","KLARIFIKASI HOAX MISLEADING CONTENT SULFUR DIOKSIDA DARI VULKANIK ERUPSI GUNUNG RUANG MENYEBAR KE PULAU JAWA https://t.co/NmCR8B61cg https://t.co/rIaqPlQUs0 https://t.co/03fg940HaJ https://t.co/o5w3mBgQqI","1786783959684415699","","","in","Katapang, Jawa Barat","0","0","0","https://twitter.com/katapang_polsek/status/1786783959684415699","1275280928646942721","katapang_polsek"
"1786782226627379411","Sat May 04 15:37:34 +0000 2024","0","Peralatan pemantauan Gunung Ruang yang baru dipasang di jarak 2 kilometer dari kawah aktif dengan tujuan memperoleh data yang lebih akurat dari aktivitas Gunung Ruang. #publisherstory #manadobacirita https://t.co/1C2Cnnt6hC","1786782226627379411","","","in","","0","0","0","https://twitter.com/kumparan/status/1786782226627379411","759692754985242625","kumparan"
"1786778961814622450","Sat May 04 15:24:35 +0000 2024","0","Pengungsi Gunung Ruang Dapat Bantuan Sayuran dan Sembako Kapolda : Untuk Kesehatan https://t.co/umN03LrkNE lewat @tribunnews","1786778961814622450","","","in","Jl AA Maramis Kairagi 2 Manado","0","0","0","https://twitter.com/Tribun_Manado/status/1786778961814622450","151700683","Tribun_Manado"
"1786776825626316994","Sat May 04 15:16:06 +0000 2024","1","Pemeriksaan Hewan Peliharaan Warga Terdampak Erupsi Gunung Ruang https://t.co/8fpSLtZojR #TempoFoto","1786776825626316994","","","in","Indonesia","0","0","1","https://twitter.com/tempodotco/status/1786776825626316994","18129942","tempodotco"
"1786776372389761055","Sat May 04 15:14:18 +0000 2024","0","Pengantar Presiden Joko Widodo Pada Ratas Penanganan Pengungsi Erupsi Gunung Ruang 3 Mei 2024 https://t.co/sIg07fNKOz","1786776372389761055","https://pbs.twimg.com/ext_tw_video_thumb/1786773134823321600/pu/img/1ZSsoxSsLlCVDTks.jpg","","in","","0","0","0","https://twitter.com/RitaRit93157572/status/1786776372389761055","1770824207640711168","RitaRit93157572"
"1786771656809255091","Sat May 04 14:55:34 +0000 2024","1","Polres Bitung Bersama Bhayangkari Cab. Bitung Serahkan Bantuan Sosial Kepada Masyarakat Korban Bencana Alam Letusan Gunung Ruang Kecamatan Tagulandang Kabupaten Kepulauan Sitaro. Bitung 4 Mei 2024 #polripedulibencana #gunungruang_tagulandangsitaro @DivHumas_Polri https://t.co/E1man5RrVP","1786771656809255091","https://pbs.twimg.com/media/GMvjWdSbMAEy7Un.jpg","","in","","0","0","0","https://twitter.com/HumPolresBitung/status/1786771656809255091","1386182291559358464","HumPolresBitung"
"1786771404366725347","Sat May 04 14:54:34 +0000 2024","0","Video: Presiden Jokowi Minta Warga Sekitar Gunung Ruang Direlokasi https://t.co/VEJbkWBdLU #beritasatu #news #berita","1786771404366725347","","","in","Jakarta","0","0","0","https://twitter.com/Beritasatu/status/1786771404366725347","154102750","Beritasatu"
"1786769857897435636","Sat May 04 14:48:25 +0000 2024","9","Menteri AHY Siapkan Wilayah Relokasi Warga Korban Erupsi Gunung Ruang Menteri ATR/Kepala BPN @AgusYudhoyono akan segera memastikan kesediaan lahan di Kabupaten Bolaang Mongondow Selatan sebagai tempat relokasi bagi para pengungsi akibat erupsi Gunung Ruang di Sulawesi Selatan. https://t.co/I6wAERP22z","1786769857897435636","https://pbs.twimg.com/media/GMvhqYxaQAAG67r.jpg","","in","Jakarta Capital Region","0","1","4","https://twitter.com/SeputarAHY/status/1786769857897435636","1347741085","SeputarAHY"
"1786769468024406158","Sat May 04 14:46:52 +0000 2024","0","KLARIFIKASI HOAX MISLEADING CONTENT SULFUR DIOKSIDA DARI VULKANIK ERUPSI GUNUNG RUANG MENYEBAR KE PULAU JAWA Beredar sebuah unggahan di Facebook membagikan informasi bahwa dampak erupsi Gunung Ruang di Sulawesi Utara menyebabkan gas SO2 atau Sulfur Dioksida yang berbahaya bagi https://t.co/lB77Ddnjyb","1786769468024406158","https://pbs.twimg.com/media/GMvdVzqbQAAbHu9.jpg","","in","","0","0","0","https://twitter.com/Polsekpmpkbdg/status/1786769468024406158","1588080583749431296","Polsekpmpkbdg"
"1786765224407699664","Sat May 04 14:30:00 +0000 2024","3","Wakil Presiden RI Ma'ruf Amin meminta warga terdampak erupsi Gunung Ruang mengikuti petunjuk dari pemerintah terkait relokasi. https://t.co/1VknfO9sZx","1786765224407699664","","","in","","0","0","0","https://twitter.com/detikcom/status/1786765224407699664","69183155","detikcom"
"1786764744013316299","Sat May 04 14:28:06 +0000 2024","1","Gunung Ruang Sitaro Erupsi Wapres Imbau Patuhi Petunjuk Mitigasi Bencana Pemerintah https://t.co/TArcKpHbgZ","1786764744013316299","","","in","","0","0","0","https://twitter.com/VIVAcoid/status/1786764744013316299","41730943","VIVAcoid"
"1786761748466585609","Sat May 04 14:16:11 +0000 2024","266","ada humanies sekitar manado ga ? Butuh info untuk kondisi warga yang sudah evakuasi pasca erupsi gunung ruang. karena di beberapa desa rumah warga sudah hancur semua. https://t.co/7efsgh7tJa","1786761748466585609","https://pbs.twimg.com/media/GMvaVmEbEAA4u2D.jpg","","in","","0","2","78","https://twitter.com/humaniesid/status/1786761748466585609","1337987604596150272","humaniesid"
"1786761246647488648","Sat May 04 14:14:12 +0000 2024","0","KLARIFIKASI HOAX MISLEADING CONTENT SULFUR DIOKSIDA DARI VULKANIK ERUPSI GUNUNG RUANG MENYEBAR KE PULAU JAWA Beredar sebuah unggahan di Facebook Rujukan : https://t.co/dykUSe9pIJ https://t.co/xOXnBsSASf https://t.co/2KmW2mR2s0 https://t.co/jrsyuBOHcT","1786761246647488648","","","in","","0","0","0","https://twitter.com/Polsekcicendo2/status/1786761246647488648","1182971550196068353","Polsekcicendo2"
"1786754894512402740","Sat May 04 13:48:57 +0000 2024","0","Wapres Imbau Masyarakat Terdampak Erupsi Gunung Ruang Ikut Petunjuk Pemerintah - https://t.co/y3807x6xrH https://t.co/F1VEDN06y1","1786754894512402740","https://pbs.twimg.com/media/GMvUG0yaoAEKuFN.jpg","","in","Manado","0","0","0","https://twitter.com/beritamanado/status/1786754894512402740","130420120","beritamanado"
"1786752663746490761","Sat May 04 13:40:05 +0000 2024","2","Kapolda Sulut Irjen Pol Yudhiawan S.H. S.I.K. M.H. https://t.co/D9Y9aDf39t. Bersama Forkopimda Hadir dlm Rapat Terbatas Penanganan Pengungsi &amp; Percepatan Relokasi Korban Erupsi Gunung Ruang dgn Kementrian Sosial RI Secara Virtual di Wisma Negara Bumi Beringin Manado (3/5). https://t.co/415CnuTO2x","1786752663746490761","https://pbs.twimg.com/media/GMvSEr_a0AAx0z5.jpg","","in","Jalan Bethesda No. 62 Manado","0","1","0","https://twitter.com/poldasulut_/status/1786752663746490761","1240859808070127622","poldasulut_"
"1786347198818754879","Sat May 04 13:35:27 +0000 2024","1","@MantraSmara Di semua berita disebut nya gunung ruang","1786751496786526217","","MantraSmara","in","","0","1","0","https://twitter.com/sprightbluu/status/1786751496786526217","1256468771922825216","sprightbluu"
"1786750772467933496","Sat May 04 13:32:35 +0000 2024","0","Jalankan Instruksi Presiden Menteri ATR/Kepala BPN Percepat Proses Pengadaan Lahan Relokasi bagi Korban Erupsi Gunung Ruang Jumat (03/05/2024). Selengkapnya di https://t.co/0MBceS7GMF https://t.co/1XkOQmrRCq","1786750772467933496","https://pbs.twimg.com/media/GMvQWwLbQAAX845.jpg","","in","Kota Pangkal Pinang, Bangka Be","0","0","0","https://twitter.com/Kantahkotapkp/status/1786750772467933496","4495846753","Kantahkotapkp"
"1786750123080364146","Sat May 04 13:30:00 +0000 2024","4","Pusat Vulkanologi dan Mitigasi Bencana Geologi (PVMBG) melaporkan status Gunung Ruang masih dalam status awas. Warga dihimbau segera evakuasi. https://t.co/KZOkTgaVYH","1786750123080364146","","","in","","0","0","0","https://twitter.com/detikcom/status/1786750123080364146","69183155","detikcom"
"1786749503879709031","Sat May 04 13:27:32 +0000 2024","0","jends! OPER KOS CEWE jl gunung lawu (ga masuk gang) mulai Mei (mingdep)-Juli 500k aja fasilitas: kasur &amp; dipan lemari &amp; meja cermin full body kamar mandi dalem dapur &amp; kulkas bersama ruang tamu parkir dalem &amp; luar ada cctv jemuran (cont..)","1786749503879709031","","","in","Purwokerto, Jawa Tengah","0","3","0","https://twitter.com/Unsoedfess1963/status/1786749503879709031","1252945132120190981","Unsoedfess1963"
"1786735755395785169","Sat May 04 13:21:25 +0000 2024","0","@moncherism ak daerah jatim . blitar km orang sulawesi ya? aman dr gunung ruang?","1786747965572534441","","moncherism","in","","0","1","0","https://twitter.com/mawar_sun/status/1786747965572534441","1667857248289439744","mawar_sun"
"1786747923277209659","Sat May 04 13:21:15 +0000 2024","0","Bantuan bencana alam untk korban erupsi Gunung Ruang Tahap ke-3 dari Polda Sulut dan Polres/TA Jajaran siap disalurkan menggunakan angkutan Truk box Logistik Brimob dan Sabhara Polda di Halaman Mapolda Sulut pada Sabtu 3/5/2024. #humaspoldasulut https://t.co/rHWx0NbKFm","1786747923277209659","https://pbs.twimg.com/media/GMvNwg7bIAAW6uz.jpg","","in","Jalan Bethesda No. 62 Manado","0","0","0","https://twitter.com/poldasulut_/status/1786747923277209659","1240859808070127622","poldasulut_"
"1786745898141442476","Sat May 04 13:13:12 +0000 2024","0","Ma'ruf Amin meminta agar warga yang terdampak erupsi Gunung Ruang mau direlokasi sesuai petunjuk pemerintah https://t.co/AtvId5Nqli","1786745898141442476","","","in","Jakarta","1","0","0","https://twitter.com/okezonenews/status/1786745898141442476","47274731","okezonenews"
"1786745222430589410","Sat May 04 13:10:31 +0000 2024","0","KLARIFIKASI HOAX-MISLEADING CONTENT SULFUR DIOKSIDA DARI VULKANIK ERUPSI GUNUNG RUANG MENYEBAR KE PULAU JAWA https://t.co/gPkmvCCqcP","1786745222430589410","https://pbs.twimg.com/media/GMvLTuxa8AAUESH.jpg","","in","","0","0","0","https://twitter.com/polsek_arahan/status/1786745222430589410","1659806208281448450","polsek_arahan"
"1786745087814463520","Sat May 04 13:09:59 +0000 2024","0","KLARIFIKASI HOAX-MISLEADING CONTENT SULFUR DIOKSIDA DARI VULKANIK ERUPSI GUNUNG RUANG MENYEBAR KE PULAU JAWA https://t.co/580ZD6r521","1786745087814463520","https://pbs.twimg.com/media/GMvLL9RbwAAvw-_.jpg","","in","","0","0","0","https://twitter.com/polsek_arahan/status/1786745087814463520","1659806208281448450","polsek_arahan"
"1786742584486105425","Sat May 04 13:00:02 +0000 2024","0","Pemerintah akan Bangun Huntap untuk Korban Erupsi Gunung Ruang https://t.co/aajNLCTstH","1786742584486105425","","","in","Jakarta, Indonesia","0","0","0","https://twitter.com/GATRA_com/status/1786742584486105425","202559038","GATRA_com"
"1786738798396920111","Sat May 04 12:45:00 +0000 2024","4","Kepala BNPB Letjen Suharyanto mengunjungi lokasi pengungsian warga terdampak erupsi Gunung Ruang. Di sana dia mendapat curhatan warga. https://t.co/JxRW5fw9mF","1786738798396920111","","","in","","0","1","1","https://twitter.com/detikcom/status/1786738798396920111","69183155","detikcom"
"1786711359230771632","Sat May 04 12:35:23 +0000 2024","21","@indoflyer masih berjibaku dengan abu yg tebal yg menempel di rw/tw dan status gunung ruang yg masih di level awas ditambah belum turunnya hujan semenjak letusan terakhir mohon doanya supaya besok sudah bisa beroperasi kembali https://t.co/iNi4HYCkuk","1786736378434449463","https://pbs.twimg.com/media/GMvDQRQbAAALzM0.jpg","indoflyer","in","Solomon Islands","1","0","6","https://twitter.com/omdeadpul/status/1786736378434449463","1449190837636648961","omdeadpul"
"1786735841538412962","Sat May 04 12:33:15 +0000 2024","0","Waspada Erupsi! BNPB Imbau Warga Evakuasi Sekitar Gunung Ruang Dalam Radius 7 Km https://t.co/ioqEBgKmPf #waspada #erupsi #bnpb #warga #evakuasi #gunung #ruang","1786735841538412962","","","in","Indonesia","0","0","1","https://twitter.com/Jurnalpatroli_/status/1786735841538412962","1507307226058223618","Jurnalpatroli_"
"1786733541864399076","Sat May 04 12:24:06 +0000 2024","0","KLARIFIKASI HOAX MISLEADING CONTENT SULFUR DIOKSIDA DARI VULKANIK ERUPSI GUNUNG RUANG MENYEBAR KE PULAU JAWA https://t.co/OedIGuOo14","1786733541864399076","https://pbs.twimg.com/media/GMvArcEagAA1kr6.jpg","","in","","0","0","0","https://twitter.com/humas_sekpatrol/status/1786733541864399076","1588131223272316929","humas_sekpatrol"
"1786733133792170322","Sat May 04 12:22:29 +0000 2024","1","Pemerintah Relokasi 301 KK dari Gunung Ruang Mereka Dibangunkan Rumah Permanen di Lokasi Baru https://t.co/2Xfkct4Bq3","1786733133792170322","","","in","Jakarta","0","0","0","https://twitter.com/jawapos/status/1786733133792170322","2392460208","jawapos"
"1786731496872821022","Sat May 04 12:15:59 +0000 2024","0","KLARIFIKASI HOAX MISLEADING CONTENT SULFUR DIOKSIDA DARI VULKANIK ERUPSI GUNUNG RUANG MENYEBAR KE PULAU JAWA https://t.co/bqfFJ62mPb. Dilansir dari https://t.co/7gPZrCz6o9 https://t.co/turAp2JavV","1786731496872821022","https://pbs.twimg.com/ext_tw_video_thumb/1786729974390755328/pu/img/cCR2Twlf79uYVxWB.jpg","","in","","0","0","0","https://twitter.com/humas_cidadap/status/1786731496872821022","1711957875281780736","humas_cidadap"
"1786730003524448368","Sat May 04 12:10:03 +0000 2024","0","KLARIFIKASI HOAX MISLEADING CONTENT SULFUR DIOKSIDA DARI VULKANIK ERUPSI GUNUNG RUANG MENYEBAR KE PULAU JAWA Rujukan : https://t.co/fsfLbq1dj8 https://t.co/N7Uq9F1Kqo https://t.co/hHT1407a8p https://t.co/sNkQbceU4r","1786730003524448368","https://pbs.twimg.com/media/GMu9dK7bcAAh3sO.jpg","","in","","0","0","0","https://twitter.com/HumasSekKdh/status/1786730003524448368","1772729098357391360","HumasSekKdh"
"1786729870032334979","Sat May 04 12:09:31 +0000 2024","0","KLARIFIKASI HOAX MISLEADING CONTENT SULFUR DIOKSIDA DARI VULKANIK ERUPSI GUNUNG RUANG MENYEBAR KE PULAU JAWA Rujukan : https://t.co/woRODa8kjE https://t.co/bpXNZnhADN https://t.co/tOJSpcxYBY https://t.co/mM2NFJ79YA","1786729870032334979","https://pbs.twimg.com/media/GMu9WAdbIAEiqPu.jpg","","in","Jl.Astanaanyar No.340 Bandung","0","0","0","https://twitter.com/polsek_astannyr/status/1786729870032334979","1588405228508176384","polsek_astannyr"
"1786729598937690397","Sat May 04 12:08:26 +0000 2024","0","KLARIFIKASI HOAX MISLEADING CONTENT SULFUR DIOKSIDA DARI VULKANIK ERUPSI GUNUNG RUANG MENYEBAR KE PULAU JAWA https://t.co/DrLT8r3olK https://t.co/fcmsxIi6XJ https://t.co/7IIQTmdcIk https://t.co/ibLB1Y0S2A","1786729598937690397","","","in","","0","0","0","https://twitter.com/PolsekSukra/status/1786729598937690397","1390213123332710401","PolsekSukra"
"1786729593619283995","Sat May 04 12:08:25 +0000 2024","0","Presiden Pimpin Rapat Penanganan Pengungsi Erupsi Gunung Ruang https://t.co/Mx62j587b6 lewat @Pelita Tangerang","1786729593619283995","","","in","","0","0","0","https://twitter.com/BasisRindra/status/1786729593619283995","1462411453667766272","BasisRindra"
"1786554434371412054","Sat May 04 12:07:36 +0000 2024","1","@NgantungInge yg gunung ruang kah??","1786729387637014659","","NgantungInge","in","Garut, Indonesia","0","1","0","https://twitter.com/chomeyni/status/1786729387637014659","1440347950849269771","chomeyni"
"1786728609237074177","Sat May 04 12:04:30 +0000 2024","2","Percepatan Pengadaan Lahan Relokasi Korban Gunung Ruang Menteri ATR Lakukan Ini: Menteri ATR/BPN Agus Harimurti Yudhoyono (AHY) mempercepat proses pengadaan lahan relokasi bagi korban erupsi Gunung Ruang di Sulawesi Utara https://t.co/pmnvN7SUyo https://t.co/NECQUapUgx","1786728609237074177","https://pbs.twimg.com/media/GMu8M5qbwAEybGX.jpg","","in","Pulo Gadung, Indonesia","0","0","0","https://twitter.com/tvOneNews/status/1786728609237074177","55507370","tvOneNews"
"1786727740718428363","Sat May 04 12:01:03 +0000 2024","0","KLARIFIKASI HOAX MISLEADING CONTENT SULFUR DIOKSIDA DARI VULKANIK ERUPSI GUNUNG RUANG MENYEBAR KE PULAU JAWA https://t.co/B86tTg8tvt","1786727740718428363","https://pbs.twimg.com/media/GMu7ZpibkAAVyc-.jpg","","in","","0","0","0","https://twitter.com/Alekempots/status/1786727740718428363","1728060720418639872","Alekempots"
