"conversation_id_str","created_at","favorite_count","full_text","id_str","image_url","in_reply_to_screen_name","lang","location","quote_count","reply_count","retweet_count","tweet_url","user_id_str","username"
"1787770862101574113","Tue May 07 09:06:03 +0000 2024","4","Memahami Aktivitas Gunung Ruang: Bahaya Tsunami Erupsi Dahsyat dan Prediksi 2036 Selengkapnya: https://t.co/o3xCr5j7E8 #ITBnews #penelitian #erupsi #Multidisiplin #TransformasiITB #ITBsolid #kampusmerdeka #transformasipendidikantinggi","1787770862101574113","","","in","Bandung - Jatinangor - Cirebon","0","0","1","https://twitter.com/itbofficial/status/1787770862101574113","22878447","itbofficial"
"1787767689068572704","Tue May 07 08:53:26 +0000 2024","0","Halo #SobATRBPN Kabupaten Bantul #Repost @kementerian.atrbpn Menindaklanjuti instruksi Presiden mengenai bencana alam erupsi Gunung Ruang di Sulawesi Utara Menteri ATR/Kepala BPN Agus Harimurti Yudhoyono meninjau langsung lokasi relokasi korban bencana di Desa Modisi. https://t.co/Tb8sHD2Ood","1787767689068572704","https://pbs.twimg.com/media/GM9tO9taMAAZex3.jpg","","in","","0","0","0","https://twitter.com/KantahKabBantul/status/1787767689068572704","1090472170055069697","KantahKabBantul"
"1787630363327774738","Tue May 07 08:49:48 +0000 2024","0","@Valhallaah Hoax disana mang islamophobia nya tinggi gk ada diberita resmi manapun yg bilang dia teriak Allahu Akbar.. namanya pun gk pernah disebut dan dia juga bukan imigran.. dia org glasgow skotlandia..","1787766774794195145","","Valhallaah","in","","0","0","0","https://twitter.com/Gunung_Raung/status/1787766774794195145","1780874387841048576","Gunung_Raung"
"1787765986600571078","Tue May 07 08:46:40 +0000 2024","0","#Repost @kementerian.atrbpn Menteri Agraria dan Tata Ruang/Kepala Badan Pertanahan Nasional (ATR/BPN) Agus Harimurti Yudhoyono (AHY) bersama sejumlah Menteri Kabinet Indonesia Maju menghadiri rapat terbatas tentang penanganan pengungsi akibat erupsi Gunung Ruang di prov. Sulut. https://t.co/wvPNvXMQyw","1787765986600571078","https://pbs.twimg.com/media/GM9rsC6boAA2z0T.jpg","","in","","0","0","0","https://twitter.com/kantahkabtdatar/status/1787765986600571078","4446262221","kantahkabtdatar"
"1787765342699499655","Tue May 07 08:44:07 +0000 2024","1","Relawan Pecinta Anjing &amp; TNI AL Evakuasi Hewan Terjebak Reruntuhan Pascaerupsi Gunung Ruang: Relawan pecinta hewan bersama TNI AL mengevakuasi hewan peliharaan yang terjebak di balik reruntuhan bangunan di dua desa yang porak-poranda dihantam erupsi https://t.co/7TVJB7YuSn","1787765342699499655","","","in","Pulo Gadung, Indonesia","0","0","0","https://twitter.com/tvOneNews/status/1787765342699499655","55507370","tvOneNews"
"1787759491070808387","Tue May 07 08:20:52 +0000 2024","31","Polri melalui jajaran Polda Sulawesi Utara (Sulut) mengirimkan bantuan kemanusiaan untuk masyarakat terdampak erupsi Gunung Ruang di wilayah Kab. Kepulauan Siau Tagulandang Biaro Sulut. Bantuan berupa bahan pangan sembako dan sayuran dikirimkan dari Mapolda Sulut Kota Manado https://t.co/KJYBemkod6","1787759491070808387","https://pbs.twimg.com/amplify_video_thumb/1787759424993656832/img/VoWFymXMCTVduKkS.jpg","","in","","0","3","7","https://twitter.com/DivHumas_Polri/status/1787759491070808387","138290629","DivHumas_Polri"
"1787755296145936505","Tue May 07 08:04:12 +0000 2024","0","Menteri AHY siapkan lahan perkebunan bagi korban erupsi Gunung Ruang https://t.co/2mdEKdEv4a","1787755296145936505","https://pbs.twimg.com/media/GM9h94-aUAAa-bw.jpg","","in","Indonesia","0","0","0","https://twitter.com/ahyforeverr/status/1787755296145936505","2756392479","ahyforeverr"
"1787755131209142624","Tue May 07 08:03:32 +0000 2024","0","Menteri AHY percepat urus lahan relokasi korban erupsi Gunung Ruang https://t.co/bSCu83NVWt","1787755131209142624","https://pbs.twimg.com/media/GM9h0SFaIAAVQgT.jpg","","in","Indonesia","0","0","0","https://twitter.com/ahyforeverr/status/1787755131209142624","2756392479","ahyforeverr"
"1787737319396806792","Tue May 07 06:52:46 +0000 2024","1","sebagai objek relokasi bagi masyarakat yang terdampak bencana alam erupsi Gunung Ruang. Simak selengkapnya pada video berikut ya Sob #AHYMenteriATR #IndonesiaLengkap #ATRBPNKiniLebihBaik #ATRBPNMajudanModern #MelayaniProfesionalTerpercaya #SetiapKitaAdalahHumas","1787737321917628727","","KantahKlungkung","in","Jl. Gajahmada No.76 Samarapura","0","0","0","https://twitter.com/KantahKlungkung/status/1787737321917628727","4513179253","KantahKlungkung"
"1787735635429888409","Tue May 07 06:46:05 +0000 2024","1","pada Minggu (05/05/2024). Kedatangannya disambut oleh Bupati Bolsel H. Iskandar Kamaru beserta jajaran juga sejumlah Kepala Kantor Pertanahan se-Sulawesi Utara. Untuk diketahui pemerintah telah menyiapkan lokasi relokasi bagi korban erupsi Gunung Ruang","1787735638319755714","","KantahKlungkung","in","Jl. Gajahmada No.76 Samarapura","0","1","0","https://twitter.com/KantahKlungkung/status/1787735638319755714","4513179253","KantahKlungkung"
"1787735404755730435","Tue May 07 06:45:12 +0000 2024","0","Desa Balehumara di Pulau Tagulandang menjadi desa yang terdampak paling parah. Letak desa yang berada di seberang Pulau Gunung Ruang membuat erupsi beberapa waktu lalu cepat merusak rumah warga. Baca selengkapnya di sini. #ErupsiGunungRuang #AdadiKompas https://t.co/1hQ0wrojIM","1787735416818532623","","hariankompas","in","Palmerah, Jakarta","0","1","0","https://twitter.com/hariankompas/status/1787735416818532623","255866913","hariankompas"
"1787735404755730435","Tue May 07 06:45:10 +0000 2024","0","Layanan seperti tempat tinggal layak hingga pemeriksaan kesehatan disediakan. Fasilitas pengantaran pun disiapkan bagi mereka yang ingin mengungsi ke rumah keluarga. Status Gunung Ruang masih berada di level IV Awas. #ErupsiGunungRuang #AdadiKompas","1787735410011217957","","hariankompas","in","Palmerah, Jakarta","0","1","0","https://twitter.com/hariankompas/status/1787735410011217957","255866913","hariankompas"
"1787735404755730435","Tue May 07 06:45:10 +0000 2024","0","Evakuasi pengungsi dari Pulau Tagulandang Sulawesi Utara akibat erupsi Gunung Ruang masih terus dilakukan. Penduduk mengungsi ke berbagai tempat seperti Kota Bitung Kota Manado hingga Kabupaten Minahasa Utara. #ErupsiGunungRuang #AdadiKompas","1787735407876313527","","hariankompas","in","Palmerah, Jakarta","0","1","0","https://twitter.com/hariankompas/status/1787735407876313527","255866913","hariankompas"
"1787735404755730435","Tue May 07 06:45:09 +0000 2024","0"," UTAS Status gunung masih Awas. Posko di Bitung Sulawesi Utara masih terus didatangi pengungsi erupsi Gunung Ruang. Baca selengkapnya di sini https://t.co/ZwXER3ywil #ErupsiGunungRuang #AdadiKompas https://t.co/dmuf5RJRIr","1787735404755730435","https://pbs.twimg.com/media/GM9OolzaYAATiPL.jpg","","in","Palmerah, Jakarta","0","1","0","https://twitter.com/hariankompas/status/1787735404755730435","255866913","hariankompas"
"1787733417255416160","Tue May 07 06:37:15 +0000 2024","0","Badan Geologi Kementerian Energi dan Sumber Daya Mineral (ESDM) menyebutkan aktivitas vulkanik Gunung Ruang di Kabupaten kepulauan Sitaro Sulawesi Utara (Sulut) masih tinggi pasca-erupsi besar pada 30 April 2024.https://t.co/67yy0s8VOx","1787733417255416160","","","in","","0","0","0","https://twitter.com/ANTARABengkulu/status/1787733417255416160","423220305","ANTARABengkulu"
"1787733128150438140","Tue May 07 06:36:06 +0000 2024","8","Menteri AHY Percepat Urus Lahan Relokasi Korban Erupsi Gunung Ruang https://t.co/o3P4WYALYv","1787733128150438140","","","in","","0","0","1","https://twitter.com/TajukPolitik/status/1787733128150438140","729309555486642176","TajukPolitik"
"1787733009359331396","Tue May 07 06:35:38 +0000 2024","6","Menteri AHY Siapkan Lahan Perkebunan Bagi Korban Erupsi Gunung Ruang https://t.co/qnhXXB0XVb","1787733009359331396","","","in","","0","0","1","https://twitter.com/TajukPolitik/status/1787733009359331396","729309555486642176","TajukPolitik"
"1787732282071286058","Tue May 07 06:32:45 +0000 2024","0","Basarnas: Evakuasi Korban Erupsi Gunung Ruang Berjalan Lancar https://t.co/kFgOJ5YL1R","1787732282071286058","","","in","DKI Jakarta","0","0","0","https://twitter.com/obsessionews/status/1787732282071286058","2653254637","obsessionews"
"1787730551216234630","Tue May 07 06:25:52 +0000 2024","0","Menteri Agraria dan Tata Ruang/Kepala Badan Pertanahan Nasional (ATR/BPN) Agus Harimurti Yudhoyono (AHY) memastikan program mempercepat mengurus lahan relokasi korban terdampak erupsi Gunung Ruang Sulawesi Utara. https://t.co/1SsOqUGshR","1787730551216234630","https://pbs.twimg.com/media/GM9LaM1aYAAih1D.jpg","","in","","0","0","0","https://twitter.com/AhyfansId/status/1787730551216234630","1597855317567885312","AhyfansId"
"1787730361478500833","Tue May 07 06:25:07 +0000 2024","0","Menteri AHY Percepat Urus Lahan Relokasi Korban Erupsi Gunung Ruang https://t.co/iYd4cRofgb","1787730361478500833","https://pbs.twimg.com/ext_tw_video_thumb/1787729890730721281/pu/img/bnTOPhfrrqa5GFyS.jpg","","in","","0","0","0","https://twitter.com/KitaHebatcom/status/1787730361478500833","1552659094695456768","KitaHebatcom"
"1787730276275331378","Tue May 07 06:24:46 +0000 2024","0","Menteri Agraria dan Tata Ruang/Kepala Badan Pertanahan Nasional (ATR/BPN) Agus Harimurti Yudhoyono (AHY) memastikan program mempercepat mengurus lahan relokasi korban terdampak erupsi Gunung Ruang Sulawesi Utara. https://t.co/aFTxPGfdXf","1787730276275331378","https://pbs.twimg.com/media/GM9LGATaAAAVZVi.jpg","","in","","0","0","0","https://twitter.com/Wildanpuasa/status/1787730276275331378","1597126978423123970","Wildanpuasa"
"1787729508784910789","Tue May 07 06:21:43 +0000 2024","6","Menteri Agraria dan Tata Ruang/Kepala Badan Pertanahan Nasional (ATR/BPN) Agus Harimurti Yudhoyono (AHY) memastikan program mempercepat mengurus lahan relokasi korban terdampak erupsi Gunung Ruang Sulawesi Utara. https://t.co/GpRegmgk36","1787729508784910789","https://pbs.twimg.com/media/GM9KglhaMAAnM2G.jpg","","in","","0","1","1","https://twitter.com/KitaHebatcom/status/1787729508784910789","1552659094695456768","KitaHebatcom"
"1787729301498138893","Tue May 07 06:20:54 +0000 2024","13","Menteri Agraria dan Tata Ruang/Kepala Badan Pertanahan Nasional (ATR/BPN) Agus Harimurti Yudhoyono (AHY) memastikan program mempercepat mengurus lahan relokasi korban terdampak erupsi Gunung Ruang Sulawesi Utara. https://t.co/bowFvxqyzt","1787729301498138893","https://pbs.twimg.com/media/GM9KUyhagAAxRd-.jpg","","in","","0","0","1","https://twitter.com/AHYS14P/status/1787729301498138893","966528152955625472","AHYS14P"
"1787729237811810692","Tue May 07 06:20:39 +0000 2024","10","Menteri AHY Percepat Urus Lahan Relokasi Korban Erupsi Gunung Ruang https://t.co/xY3kjRXoED","1787729237811810692","https://pbs.twimg.com/ext_tw_video_thumb/1787728910328983552/pu/img/-rTFXviDGTZGPhNB.jpg","","in","","0","0","1","https://twitter.com/AHYS14P/status/1787729237811810692","966528152955625472","AHYS14P"
"1787728324682551359","Tue May 07 06:17:01 +0000 2024","0","Basarnas nyatakan evakuasi korban erupsi Gunung Ruang berjalan lancar https://t.co/7XxXIaOLOE","1787728324682551359","","","in","Indonesia","0","0","0","https://twitter.com/webelshinta/status/1787728324682551359","1482999200988434435","webelshinta"
"1787727696245706889","Tue May 07 06:14:31 +0000 2024","4","Ketika AHY Tinjau Lokasi Relokasi Warga yang Terdampak Erupsi Gunung Ruang Dalam kunker di Desa Modisi Bolaang Mongondow Selatan Menteri @AgusYudhoyono meninjau calon lokasi relokasi warga yg disiapkan Pemkab utk memastikan apakah sudah clean &amp; clear. https://t.co/wbTDTUlHUz https://t.co/7qQ70tQFi2","1787727696245706889","https://pbs.twimg.com/media/GM9Hra0agAAE_qa.jpg","","in","Jakarta Capital Region","0","0","3","https://twitter.com/SeputarAHY/status/1787727696245706889","1347741085","SeputarAHY"
"1787723789184229637","Tue May 07 05:59:00 +0000 2024","1","Kondisi terkini Gunung Ruang awan panas dan semburan abu vulkanik masih berpotensi terjadi. Yuk simak informasi selengkapnya disini. #EsensiTV #BeritaTerikini #Erupsi #GunungRuang #Sulut #Siagabencana #Viral #Fyp https://t.co/1eWwTQq5y1","1787723789184229637","https://pbs.twimg.com/ext_tw_video_thumb/1787704109128441856/pu/img/fL93VdNuaI7PVltj.jpg","","in","Indonesia","0","0","0","https://twitter.com/Esensi_TV/status/1787723789184229637","1656562862201122817","Esensi_TV"
"1787722373757804863","Tue May 07 05:53:22 +0000 2024","1","Manado - Cuaca di Kota Manado saat ini sedang tidak menentu dan juga dampak erupsi dari gunung api ruang masih menyisahkan abu vulkanik. Maka dari itu saya sampaikan sesuai dengan himbauan Kepala Kantor Wilayah Ronald Lumbuun kepada seluruh Jajaran Kantor Wilayah untuk https://t.co/47hwt9bzNh","1787722373757804863","https://pbs.twimg.com/media/GM9EAYuaUAA9JMH.jpg","","in","Kota Manado, Sulawesi Utara","0","0","0","https://twitter.com/Imigrasi_Manado/status/1787722373757804863","1128832702474477568","Imigrasi_Manado"
"1787721633773576572","Tue May 07 05:50:26 +0000 2024","1","Presiden Jokowi berikan perhatian penuh kepada para korban erupsi gunung ruang tag || Innalillahi Ricis tjoe Zendaya Mahalini Islam eko patrio Mokondo Ryan Ganta Mulan Blake Lively #GISELLE || https://t.co/NkXhkgMjqe","1787721633773576572","https://pbs.twimg.com/ext_tw_video_thumb/1787721031081472001/pu/img/OUDZAlLs84QcGf9S.jpg","","in","Gorontalo","0","0","1","https://twitter.com/FathinaHamdi/status/1787721633773576572","1534789268068913152","FathinaHamdi"
"1787719502752604484","Tue May 07 05:41:58 +0000 2024","2","Menteri AHY pastikan lahan relokasi korban erupsi Gunung Ruang clean and clear https://t.co/u4pyeNXjrR","1787719502752604484","https://pbs.twimg.com/media/GM9BaIia4AAQ1e8.jpg","","in","","0","0","2","https://twitter.com/AHYB4NGK1T/status/1787719502752604484","1597100222672687109","AHYB4NGK1T"
"1787715308830306365","Tue May 07 05:25:18 +0000 2024","0","KPP Pratama Tahuna menyampaikan bantuan sosial untuk para korban erupsi Gunung Ruang di Kepulauan Tagulandang melalui Pemerintah Daerah Kab. Kepl. Siau Tagulandang Biaro yang bertempat di Pos Terpadu Penanganan Darurat Bencana Erupsi Gunung Ruang pada Kamis (2/5). https://t.co/3xn2it85D9","1787715308830306365","https://pbs.twimg.com/media/GM89iC3aAAAkrvj.jpg","","in","Kep. Sangihe - Sulawesi Utara","0","0","1","https://twitter.com/PajakTahuna/status/1787715308830306365","1425790652","PajakTahuna"
"1787714032851648721","Tue May 07 05:20:14 +0000 2024","0","Pagi ini pada penerbangan pertama pukul 03.55 saya take off menuju Sulawesi untuk segera menuju ke lokasi yang akan dijadikan tempat relokasi masyarakat terdampak erupsi Gunung Ruang di Sulawesi Utara. https://t.co/0VmIqNfXvI","1787714032851648721","https://pbs.twimg.com/ext_tw_video_thumb/1787713921262166016/pu/img/CNlvJLfXGCW2rx16.jpg","","in","Jl. La Ode Mbai Maswar No. 2","0","0","0","https://twitter.com/ATR_BPNWakatobi/status/1787714032851648721","1541257776760262656","ATR_BPNWakatobi"
"1787710641827992001","Tue May 07 05:06:45 +0000 2024","0","Pada Minggu (05/05/2024) Menteri ATR/BPN Agus Harimurti Yudhoyono (AHY) bertolak ke Bandara Gorontalo untuk kemudian melanjutkan perjalanan meninjau calon lahan relokasi warga pengungsi yang terdampak erupsi Gunung Ruang di Desa Modisi Kabupaten Bolaang Mongondow Selatan. https://t.co/VcXOKhbpwo","1787710641827992001","https://pbs.twimg.com/media/GM85VJ2boAAxAas.jpg","","in","Kabupaten Luwu, Belopa 91994","0","1","0","https://twitter.com/kantahkabluwu/status/1787710641827992001","1235008136932552704","kantahkabluwu"
"1787522434217738536","Tue May 07 05:05:27 +0000 2024","0","@AMAZlNGNATURE Search for Gunung Ruang on YT or TT. Thanks me later","1787710313988870625","","AMAZlNGNATURE","en","New York, USA","0","0","0","https://twitter.com/imnotdidit/status/1787710313988870625","524208248","imnotdidit"
"1787708943336157563","Tue May 07 05:00:00 +0000 2024","1","Usai erupsi aktivitas Gunung Ruang masih pada level 4 atau Awas. Banyaknya warga yang telah di evakuasi membuat wilayah sekitar Gunung Ruang sepi tanpa aktivitas seperti kota mati. https://t.co/ns6OyEQkD6 https://t.co/IGlYUhmE9b","1787708943336157563","https://pbs.twimg.com/media/GM8nKp8aIAAKhuO.jpg","","in","Indonesia","0","1","0","https://twitter.com/CNNIDdaily/status/1787708943336157563","3306771829","CNNIDdaily"
"1787705846216183967","Tue May 07 04:47:42 +0000 2024","3","#MetroSiang Mitigasi bencana geologi Gunung Ruang Streaming Youtube : https://t.co/PZD9WHGv5Y https://t.co/tiMGeRYokG","1787705846216183967","https://pbs.twimg.com/media/GM804T7aUAA8kBd.jpg","","in","","0","0","0","https://twitter.com/Metro_TV/status/1787705846216183967","57261519","Metro_TV"
"1787704631180865803","Tue May 07 04:42:52 +0000 2024","2","Halo #SobATRBPN #Manado Kegiatan Menteri Agraria dan Tata Ruang/Kepala BPN Bapak Agus Harimurti Yudhoyono meninjau calon lahan relokasi warga pengungsi yang terdampak erupsi Gunung Ruang di Kabupaten Bolaang Mongondow Selatan Sulawesi Utara diliput oleh beberapa media. https://t.co/d2tYRpsAOA","1787704631180865803","https://pbs.twimg.com/media/GM8zvfXbkAA3FiJ.jpg","","in","Tingkulu, Wanea, Manado","0","0","0","https://twitter.com/kantahkotmanado/status/1787704631180865803","1122665901734551552","kantahkotmanado"
"1787703984641511789","Tue May 07 04:40:18 +0000 2024","0","#MetroSiang Erupsi Gunung Ruang sebanyak 6000 warga di evakuasi dan pertimbangan untuk relokasi warga untuk menghindari adanya letusan kembali. Streaming Youtube : https://t.co/PZD9WHGv5Y https://t.co/uemttgQ6vP","1787703984641511789","https://pbs.twimg.com/media/GM8zC7zbEAAMO1R.jpg","","in","","0","0","0","https://twitter.com/Metro_TV/status/1787703984641511789","57261519","Metro_TV"
"1787703704734572800","Tue May 07 04:39:11 +0000 2024","0","Repost : @kementerian.atrbpn . . . Halo #SobATRBPN menindaklanjuti instruksi Presiden Joko Widodo mengenai bencana alam erupsi Gunung Ruang di Sulawesi Utara Menteri ATR/Kepala BPN Agus Harimurti Yudhoyono (AHY) meninjau . . . https://t.co/DPLFZX2KGE","1787703704734572800","","","in","Sengeti, Muaro Jambi, Jambi","0","0","0","https://twitter.com/kantahmuarojmbi/status/1787703704734572800","1231805458593136640","kantahmuarojmbi"
"1787703234263667090","Tue May 07 04:37:19 +0000 2024","0","#Repost @kementerian.atrbpn Halo #SobATRBPN menindaklanjuti instruksi Presiden Joko Widodo mengenai bencana alam erupsi Gunung Ruang di Sulawesi Utara Menteri ATR/Kepala BPN AHY meninjau langsung lokasi relokasi korban bencana tersebut di Desa Modisi. https://t.co/QOhYB7ScXL","1787703234263667090","https://pbs.twimg.com/media/GM8yngaboAA0FjK.jpg","","in","Melawi, Kalimantan Barat, Indonesia","0","0","0","https://twitter.com/kantahkabmelawi/status/1787703234263667090","4432315108","kantahkabmelawi"
"1787695751692468729","Tue May 07 04:07:35 +0000 2024","0","Proses Evakuasi Korban Erupsi Gunung Ruang Berjalan Lancar https://t.co/0TR9woCJ30 #beritasatu #news #berita","1787695751692468729","","","in","Jakarta","0","0","0","https://twitter.com/Beritasatu/status/1787695751692468729","154102750","Beritasatu"
"1787693843934298267","Tue May 07 04:00:00 +0000 2024","0","Halo #SobATRBPN menindaklanjuti instruksi Presiden Joko Widodo mengenai bencana alam erupsi Gunung Ruang di Sulawesi Utara Menteri AHY menyampaikan pesan bahwa Kementerian ATR/BPN hadir untuk memastikan tanah untuk relokasi clean and clear. Simak selengkapnya Sob https://t.co/QdANrECmky","1787693843934298267","https://pbs.twimg.com/media/GM8J3Kjb0AEVkzJ.jpg","","in","Penajam","0","0","0","https://twitter.com/kantahkabppu/status/1787693843934298267","1143722231735832576","kantahkabppu"
"1787692415501173201","Tue May 07 03:54:20 +0000 2024","2","Repost @kementerian.atrbpn Halo #SobATRBPN menindaklanjuti instruksi Presiden Joko Widodo mengenai bencana alam erupsi Gunung Ruang di Sulawesi Utara Menteri ATR/Kepala BPN Agus Harimurti Yudhoyono (AHY) https://t.co/5oRNZKlheL","1787692415501173201","https://pbs.twimg.com/media/GM8oxVSaIAMwnKT.jpg","","in","Bandar Lampung, Lampung","0","0","0","https://twitter.com/AtrbpnBalam/status/1787692415501173201","1043651493948153856","AtrbpnBalam"
"1787690724148080918","Tue May 07 03:47:36 +0000 2024","0","#Repost @kem_atrbpn Halo #SobATRBPN menindaklanjuti instruksi Presiden Joko Widodo mengenai bencana alam erupsi Gunung Ruang di Sulawesi Utara Menteri ATR/Kepala BPN meninjau langsung lokasi relokasi korban bencana tersebut di Desa Modisi. https://t.co/YwhpHo3o9o","1787690724148080918","","","in","Jl. Kauman No. 12 Cilacap","0","0","0","https://twitter.com/kantahcilacap/status/1787690724148080918","3166242626","kantahcilacap"
"1787690398015771103","Tue May 07 03:46:19 +0000 2024","0","Repost @kementerian.atrbpn Halo #SobATRBPN menindaklanjuti instruksi Presiden Joko Widodo mengenai bencana alam erupsi Gunung Ruang di Sulawesi Utara Menteri ATR/ Kepala BPN Agus Harimurti Yudhoyono (AHY) meninjau langsung lokasi relokasi korban bencana tersebut di DesaModisi https://t.co/UY8zl46Nsw","1787690398015771103","https://pbs.twimg.com/media/GM8m7yWbQAEqPFj.jpg","","in","Tulang Bawang Tengah, Indonesi","0","0","0","https://twitter.com/atrbpn_tubaba/status/1787690398015771103","1500656419691188225","atrbpn_tubaba"
"1787688463984480476","Tue May 07 03:38:38 +0000 2024","0","#Reposted from @kem_atrbpn Halo #SobATRBPN menindaklanjuti instruksi Presiden Joko Widodo mengenai bencana alam erupsi Gunung Ruang di Sulawesi Utara Menteri ATR/Kepala BPN Agus Harimurti Yudhoyono (AHY) meninjau langsung lokasi relokasi https://t.co/a8ohmRqw4q","1787688463984480476","","","in","Nusa Tenggara Timur, Indonesia","0","1","0","https://twitter.com/bpn_lembata/status/1787688463984480476","1244525836327256064","bpn_lembata"
"1787688360624238608","Tue May 07 03:38:13 +0000 2024","0","Halo #SobATRBPN menindaklanjuti instruksi Presiden Joko Widodo mengenai bencana alam erupsi Gunung Ruang di Sulawesi Utara Menteri ATR/Kepala BPN Agus Harimurti Yudhoyono (AHY) meninjau langsung lokasi relokasi korban bencana tersebut di Desa Modisi. https://t.co/0XuC13TugT","1787688360624238608","https://pbs.twimg.com/media/GM8k-6UbsAAikui.jpg","","in","Kota Sabang","0","1","0","https://twitter.com/kantahkotsabang/status/1787688360624238608","986433814447538176","kantahkotsabang"
"1787687863372673210","Tue May 07 03:36:15 +0000 2024","0","Pada kesempatan ini Menteri ATR/Kepala BPN melakukan pemeriksaan terhadap kondisi dan status lahan yang dipersiapkan sebagai objek relokasi bagi masyarakat yang terdampak bencana alam erupsi Gunung Ruang.","1787687865926992277","","kantahkotsabang","in","Kota Sabang","0","1","0","https://twitter.com/kantahkotsabang/status/1787687865926992277","986433814447538176","kantahkotsabang"
"1787685959628456379","Tue May 07 03:28:41 +0000 2024","0","Halo #SobATRBPN menindaklanjuti instruksi Presiden Joko Widodo mengenai bencana alam erupsi Gunung Ruang di Sulawesi Utara Menteri ATR/Kepala BPN Agus Harimurti Yudhoyono (AHY) meninjau langsung lokasi relokasi korban bencana tersebut di Desa Modisi. Dalam kesempatan tersebut https://t.co/MNrjp99ndl","1787685959628456379","https://pbs.twimg.com/media/GM8i56na4AAEYlE.jpg","","in","","0","1","0","https://twitter.com/kantah_kotabaru/status/1787685959628456379","1281964939674968064","kantah_kotabaru"
"1787685591670497479","Tue May 07 03:27:13 +0000 2024","0","Repost @agusyudhoyono Setelah menempuh perjalanan darat sekitar 7 jam dari Gorontalo Alhamdulillah saya dapat meninjau secara langsung titik relokasi untuk korban bencana Gunung Ruang di Kabupaten Bolaang Mongondow Selatan. https://t.co/bzSbF7IAWN","1787685591670497479","https://pbs.twimg.com/ext_tw_video_thumb/1787685204909543424/pu/img/Wq5pv_uwiAv2rPoI.jpg","","in","Tulang Bawang Tengah, Indonesi","0","0","0","https://twitter.com/atrbpn_tubaba/status/1787685591670497479","1500656419691188225","atrbpn_tubaba"
"1787684665194959107","Tue May 07 03:23:32 +0000 2024","0","Fransiscus Silangen Apresiasi Upaya Olly Dondokambey Tangani Pengungsi Gunung Ruang - https://t.co/2qw43p7WdL https://t.co/1YTc1gWLmH","1787684665194959107","https://pbs.twimg.com/media/GM8hunKagAA2sgs.jpg","","in","Manado","0","0","0","https://twitter.com/beritamanado/status/1787684665194959107","130420120","beritamanado"
"1787683470267101605","Tue May 07 03:18:47 +0000 2024","0","halo #sobATRBPN Menteri ATR/Kepala BPN melaksanakan cek langsung tanah relokasi korban erypsi Gunung Ruang. https://t.co/NnfuPnflkH","1787683470267101605","https://pbs.twimg.com/media/GM8goevbUAAUmmp.jpg","","in","","0","0","0","https://twitter.com/KantahWayKanan/status/1787683470267101605","1503570744940576769","KantahWayKanan"
"1787683079156559966","Tue May 07 03:17:15 +0000 2024","0","objek relokasi bagi masyarakat yang terdampak bencana alam erupsi Gunung Ruang. Simak selengkapnya pada video berikut ya Sob #AHYMenteriATR #IndonesiaLengkap #ATRBPNKiniLebihBaik #ATRBPNMajudanModern #MelayaniProfesionalTerpercaya #SetiapKitaAdalahHumas Repost @kem_atrbpn","1787683085963972611","","kantah_atam","in","Aceh Tamiang, Aceh","0","0","0","https://twitter.com/kantah_atam/status/1787683085963972611","1258312502041026560","kantah_atam"
"1787682973032313239","Tue May 07 03:16:48 +0000 2024","22","Lantamal VIII Manado Melaksanakan Evakuasi Warga Korban Bencana Alam Erupsi Gunung Ruang #tni #tnipeduli #erupsi #gunungruang #tniprima #profesional #responsif #integratif #modern #adaptif #bersamarakyattnikuat #puspentni https://t.co/yOgl5wrmkS","1787682973032313239","https://pbs.twimg.com/ext_tw_video_thumb/1787682706362646528/pu/img/B7SF5fT_cg_e0A9M.jpg","","in","Mabes TNI, Cilangkap","0","2","6","https://twitter.com/Puspen_TNI/status/1787682973032313239","594386753","Puspen_TNI"
